{"adapter":{"name":"sample-adapter","version":"1.0.0"},"bundle_root_hash":"a1b2c3d4e5f6789012345678901234567890123456789012345678901234abcd","evidence_hashes":{"meta":"1234567890abcdef1234567890abcdef1234567890abcdef1234567890abcdef","sample_agent-identity-request":"abcdef1234567890abcdef1234567890abcdef1234567890abcdef1234567890"},"issued_at":"2026-03-01T00:00:00Z","issuer_key_id":"specora-root-key","proof_surface_url":"https://specora.ai/proof","protocol_version":"1.0.0","requirements_met":["STP-REQ-101","STP-REQ-102","STP-REQ-103","STP-REQ-104","STP-REQ-105","STP-REQ-106","STP-REQ-107","STP-REQ-108","STP-REQ-109","STP-REQ-110"],"requirements_missing":[],"schema_version":"1.0.0","spec_id":"stp-certification-attestation","tier":"compatible"}